ubuntu@ip-10-0-22-13:~/code/openmrs-module-billing$ mvn clean install
[INFO] Scanning for projects...
[WARNING] 
[WARNING] Some problems were encountered while building the effective model for org.openmrs.module:billing-api:jar:1.3.3-SNAPSHOT
[WARNING] 'build.plugins.plugin.version' for org.apache.maven.plugins:maven-compiler-plugin is missing. @ line 116, column 12
[WARNING] 
[WARNING] It is highly recommended to fix these problems because they threaten the stability of your build.
[WARNING] 
[WARNING] For this reason, future Maven versions might no longer support building such malformed projects.
[WARNING] 
[INFO] ------------------------------------------------------------------------
[INFO] Reactor Build Order:
[INFO] 
[INFO] OpenHMIS Billing Module                                            [pom]
[INFO] OpenMrs Billing Module API                                         [jar]
[INFO] OpenHMIS Billing Module OMOD                                       [jar]
[INFO] 
[INFO] ---------------------< org.openmrs.module:billing >---------------------
[INFO] Building OpenHMIS Billing Module 1.3.3-SNAPSHOT                    [1/3]
[INFO] --------------------------------[ pom ]---------------------------------
[INFO] 
[INFO] --- maven-clean-plugin:2.5:clean (default-clean) @ billing ---
[INFO] 
[INFO] --- maven-install-plugin:2.4:install (default-install) @ billing ---
[INFO] Installing /home/ubuntu/code/openmrs-module-billing/pom.xml to /home/ubuntu/.m2/repository/org/openmrs/module/billing/1.3.3-SNAPSHOT/billing-1.3.3-SNAPSHOT.pom
[INFO] 
[INFO] -------------------< org.openmrs.module:billing-api >-------------------
[INFO] Building OpenMrs Billing Module API 1.3.3-SNAPSHOT                 [2/3]
[INFO] --------------------------------[ jar ]---------------------------------
Downloading from openmrs-repo: https://openmrs.jfrog.io/openmrs/public/org/openmrs/api/openmrs-api/2.4.0/openmrs-api-2.4.0.pom
Downloaded from openmrs-repo: https://openmrs.jfrog.io/openmrs/public/org/openmrs/api/openmrs-api/2.4.0/openmrs-api-2.4.0.pom (13 kB at 22 kB/s)
Downloading from openmrs-repo: https://openmrs.jfrog.io/openmrs/public/joda-time/joda-time/2.10.14/joda-time-2.10.14.pom
Downloaded from openmrs-repo: https://openmrs.jfrog.io/openmrs/public/joda-time/joda-time/2.10.14/joda-time-2.10.14.pom (37 kB at 136 kB/s)
Downloading from openmrs-repo: https://openmrs.jfrog.io/openmrs/public/org/openmrs/web/openmrs-web/2.4.0/openmrs-web-2.4.0.pom
Downloaded from openmrs-repo: https://openmrs.jfrog.io/openmrs/public/org/openmrs/web/openmrs-web/2.4.0/openmrs-web-2.4.0.pom (6.1 kB at 32 kB/s)
Downloading from openmrs-repo: https://openmrs.jfrog.io/openmrs/public/org/openmrs/test/openmrs-test/2.4.0/openmrs-test-2.4.0.pom
Downloaded from openmrs-repo: https://openmrs.jfrog.io/openmrs/public/org/openmrs/test/openmrs-test/2.4.0/openmrs-test-2.4.0.pom (2.9 kB at 16 kB/s)
Downloading from openmrs-repo: https://openmrs.jfrog.io/openmrs/public/org/openmrs/module/stockmanagement-api/1.4.0/stockmanagement-api-1.4.0.pom
Downloaded from openmrs-repo: https://openmrs.jfrog.io/openmrs/public/org/openmrs/module/stockmanagement-api/1.4.0/stockmanagement-api-1.4.0.pom (1.4 kB at 5.3 kB/s)
Downloading from openmrs-repo: https://openmrs.jfrog.io/openmrs/public/org/openmrs/module/stockmanagement/1.4.0/stockmanagement-1.4.0.pom
Downloaded from openmrs-repo: https://openmrs.jfrog.io/openmrs/public/org/openmrs/module/stockmanagement/1.4.0/stockmanagement-1.4.0.pom (4.5 kB at 12 kB/s)
Downloading from openmrs-repo: https://openmrs.jfrog.io/openmrs/public/org/openmrs/maven/parents/maven-parent-openmrs-module/1.1.1/maven-parent-openmrs-module-1.1.1.pom
Downloaded from openmrs-repo: https://openmrs.jfrog.io/openmrs/public/org/openmrs/maven/parents/maven-parent-openmrs-module/1.1.1/maven-parent-openmrs-module-1.1.1.pom (15 kB at 85 kB/s)
Downloading from openmrs-repo: https://openmrs.jfrog.io/openmrs/public/org/openmrs/distro/referenceapplication/2.10.0/referenceapplication-2.10.0.pom
Downloaded from openmrs-repo: https://openmrs.jfrog.io/openmrs/public/org/openmrs/distro/referenceapplication/2.10.0/referenceapplication-2.10.0.pom (40 kB at 221 kB/s)
Downloading from openmrs-repo: https://openmrs.jfrog.io/openmrs/public/org/openmrs/module/uiframework-api/3.4/uiframework-api-3.4.pom
Downloaded from openmrs-repo: https://openmrs.jfrog.io/openmrs/public/org/openmrs/module/uiframework-api/3.4/uiframework-api-3.4.pom (2.5 kB at 14 kB/s)
Downloading from openmrs-repo: https://openmrs.jfrog.io/openmrs/public/org/openmrs/module/uiframework/3.4/uiframework-3.4.pom
Downloaded from openmrs-repo: https://openmrs.jfrog.io/openmrs/public/org/openmrs/module/uiframework/3.4/uiframework-3.4.pom (8.5 kB at 47 kB/s)
Downloading from openmrs-repo: https://openmrs.jfrog.io/openmrs/public/com/github/jknack/handlebars/1.3.1/handlebars-1.3.1.pom
Downloaded from openmrs-repo: https://openmrs.jfrog.io/openmrs/public/com/github/jknack/handlebars/1.3.1/handlebars-1.3.1.pom (4.6 kB at 26 kB/s)
Downloading from openmrs-repo: https://openmrs.jfrog.io/openmrs/public/com/github/jknack/handlebars.java/1.3.1/handlebars.java-1.3.1.pom
Downloaded from openmrs-repo: https://openmrs.jfrog.io/openmrs/public/com/github/jknack/handlebars.java/1.3.1/handlebars.java-1.3.1.pom (14 kB at 78 kB/s)
Downloading from openmrs-repo: https://openmrs.jfrog.io/openmrs/public/org/apache/commons/commons-lang3/3.1/commons-lang3-3.1.pom
Downloaded from openmrs-repo: https://openmrs.jfrog.io/openmrs/public/org/apache/commons/commons-lang3/3.1/commons-lang3-3.1.pom (17 kB at 92 kB/s)
Downloading from openmrs-repo: https://openmrs.jfrog.io/openmrs/public/org/antlr/antlr4-runtime/4.2.2/antlr4-runtime-4.2.2.pom
Downloaded from openmrs-repo: https://openmrs.jfrog.io/openmrs/public/org/antlr/antlr4-runtime/4.2.2/antlr4-runtime-4.2.2.pom (4.8 kB at 26 kB/s)
Downloading from openmrs-repo: https://openmrs.jfrog.io/openmrs/public/org/antlr/antlr4-master/4.2.2/antlr4-master-4.2.2.pom
Downloaded from openmrs-repo: https://openmrs.jfrog.io/openmrs/public/org/antlr/antlr4-master/4.2.2/antlr4-master-4.2.2.pom (7.9 kB at 44 kB/s)
Downloading from openmrs-repo: https://openmrs.jfrog.io/openmrs/public/org/antlr/antlr4-annotations/4.2.2/antlr4-annotations-4.2.2.pom
Downloaded from openmrs-repo: https://openmrs.jfrog.io/openmrs/public/org/antlr/antlr4-annotations/4.2.2/antlr4-annotations-4.2.2.pom (1.3 kB at 6.8 kB/s)
Downloading from openmrs-repo: https://openmrs.jfrog.io/openmrs/public/org/mozilla/rhino/1.7R4/rhino-1.7R4.pom
Downloaded from openmrs-repo: https://openmrs.jfrog.io/openmrs/public/org/mozilla/rhino/1.7R4/rhino-1.7R4.pom (1.3 kB at 7.1 kB/s)
Downloading from openmrs-repo: https://openmrs.jfrog.io/openmrs/public/org/openmrs/module/idgen-api/4.7.0/idgen-api-4.7.0.pom
Downloaded from openmrs-repo: https://openmrs.jfrog.io/openmrs/public/org/openmrs/module/idgen-api/4.7.0/idgen-api-4.7.0.pom (795 B at 4.4 kB/s)
Downloading from openmrs-repo: https://openmrs.jfrog.io/openmrs/public/org/openmrs/module/idgen/4.7.0/idgen-4.7.0.pom
Downloaded from openmrs-repo: https://openmrs.jfrog.io/openmrs/public/org/openmrs/module/idgen/4.7.0/idgen-4.7.0.pom (9.9 kB at 55 kB/s)
Downloading from openmrs-repo: https://openmrs.jfrog.io/openmrs/public/org/apache/httpcomponents/httpclient/4.5.10/httpclient-4.5.10.pom
Downloaded from openmrs-repo: https://openmrs.jfrog.io/openmrs/public/org/apache/httpcomponents/httpclient/4.5.10/httpclient-4.5.10.pom (6.6 kB at 37 kB/s)
Downloading from openmrs-repo: https://openmrs.jfrog.io/openmrs/public/org/apache/httpcomponents/httpcomponents-client/4.5.10/httpcomponents-client-4.5.10.pom
Downloaded from openmrs-repo: https://openmrs.jfrog.io/openmrs/public/org/apache/httpcomponents/httpcomponents-client/4.5.10/httpcomponents-client-4.5.10.pom (16 kB at 87 kB/s)
Downloading from openmrs-repo: https://openmrs.jfrog.io/openmrs/public/org/apache/httpcomponents/httpcore/4.4.12/httpcore-4.4.12.pom
Downloaded from openmrs-repo: https://openmrs.jfrog.io/openmrs/public/org/apache/httpcomponents/httpcore/4.4.12/httpcore-4.4.12.pom (5.0 kB at 27 kB/s)
Downloading from openmrs-repo: https://openmrs.jfrog.io/openmrs/public/org/apache/httpcomponents/httpcomponents-core/4.4.12/httpcomponents-core-4.4.12.pom
Downloaded from openmrs-repo: https://openmrs.jfrog.io/openmrs/public/org/apache/httpcomponents/httpcomponents-core/4.4.12/httpcomponents-core-4.4.12.pom (13 kB at 71 kB/s)
Downloading from openmrs-repo: https://openmrs.jfrog.io/openmrs/public/org/reflections/reflections/0.9.8/reflections-0.9.8.pom
Downloaded from openmrs-repo: https://openmrs.jfrog.io/openmrs/public/org/reflections/reflections/0.9.8/reflections-0.9.8.pom (2.9 kB at 16 kB/s)
Downloading from openmrs-repo: https://openmrs.jfrog.io/openmrs/public/org/reflections/reflections-parent/0.9.8/reflections-parent-0.9.8.pom
Downloaded from openmrs-repo: https://openmrs.jfrog.io/openmrs/public/org/reflections/reflections-parent/0.9.8/reflections-parent-0.9.8.pom (3.3 kB at 18 kB/s)
Downloading from openmrs-repo: https://openmrs.jfrog.io/openmrs/public/com/google/guava/guava/11.0.2/guava-11.0.2.pom
Downloaded from openmrs-repo: https://openmrs.jfrog.io/openmrs/public/com/google/guava/guava/11.0.2/guava-11.0.2.pom (5.5 kB at 29 kB/s)
Downloading from openmrs-repo: https://openmrs.jfrog.io/openmrs/public/com/google/guava/guava-parent/11.0.2/guava-parent-11.0.2.pom
Downloaded from openmrs-repo: https://openmrs.jfrog.io/openmrs/public/com/google/guava/guava-parent/11.0.2/guava-parent-11.0.2.pom (2.0 kB at 11 kB/s)
Downloading from openmrs-repo: https://openmrs.jfrog.io/openmrs/public/com/itextpdf/kernel/8.0.2/kernel-8.0.2.pom
Downloaded from openmrs-repo: https://openmrs.jfrog.io/openmrs/public/com/itextpdf/kernel/8.0.2/kernel-8.0.2.pom (2.1 kB at 12 kB/s)
Downloading from openmrs-repo: https://openmrs.jfrog.io/openmrs/public/com/itextpdf/root/8.0.2/root-8.0.2.pom
Downloaded from openmrs-repo: https://openmrs.jfrog.io/openmrs/public/com/itextpdf/root/8.0.2/root-8.0.2.pom (29 kB at 155 kB/s)
Downloading from openmrs-repo: https://openmrs.jfrog.io/openmrs/public/com/itextpdf/bouncy-castle-connector/8.0.2/bouncy-castle-connector-8.0.2.pom
Downloaded from openmrs-repo: https://openmrs.jfrog.io/openmrs/public/com/itextpdf/bouncy-castle-connector/8.0.2/bouncy-castle-connector-8.0.2.pom (2.4 kB at 12 kB/s)
Downloading from openmrs-repo: https://openmrs.jfrog.io/openmrs/public/com/itextpdf/io/8.0.2/io-8.0.2.pom
Downloaded from openmrs-repo: https://openmrs.jfrog.io/openmrs/public/com/itextpdf/io/8.0.2/io-8.0.2.pom (1.7 kB at 9.2 kB/s)
Downloading from openmrs-repo: https://openmrs.jfrog.io/openmrs/public/com/itextpdf/commons/8.0.2/commons-8.0.2.pom
Downloaded from openmrs-repo: https://openmrs.jfrog.io/openmrs/public/com/itextpdf/commons/8.0.2/commons-8.0.2.pom (1.0 kB at 5.8 kB/s)
Downloading from openmrs-repo: https://openmrs.jfrog.io/openmrs/public/com/itextpdf/layout/8.0.2/layout-8.0.2.pom
Downloaded from openmrs-repo: https://openmrs.jfrog.io/openmrs/public/com/itextpdf/layout/8.0.2/layout-8.0.2.pom (1.3 kB at 7.0 kB/s)
Downloading from openmrs-repo: https://openmrs.jfrog.io/openmrs/public/com/itextpdf/barcodes/8.0.2/barcodes-8.0.2.pom
Downloaded from openmrs-repo: https://openmrs.jfrog.io/openmrs/public/com/itextpdf/barcodes/8.0.2/barcodes-8.0.2.pom (893 B at 4.8 kB/s)
Downloading from openmrs-repo: https://openmrs.jfrog.io/openmrs/public/com/itextpdf/font-asian/8.0.2/font-asian-8.0.2.pom
Downloaded from openmrs-repo: https://openmrs.jfrog.io/openmrs/public/com/itextpdf/font-asian/8.0.2/font-asian-8.0.2.pom (1.5 kB at 8.7 kB/s)
Downloading from openmrs-repo: https://openmrs.jfrog.io/openmrs/public/org/openmrs/api/openmrs-api/2.4.0/openmrs-api-2.4.0.jar
Downloading from openmrs-repo: https://openmrs.jfrog.io/openmrs/public/org/openmrs/module/stockmanagement-api/1.4.0/stockmanagement-api-1.4.0.jar
Downloading from openmrs-repo: https://openmrs.jfrog.io/openmrs/public/org/openmrs/api/openmrs-api/2.4.0/openmrs-api-2.4.0-tests.jar
Downloading from openmrs-repo: https://openmrs.jfrog.io/openmrs/public/org/openmrs/web/openmrs-web/2.4.0/openmrs-web-2.4.0.jar
Downloading from openmrs-repo: https://openmrs.jfrog.io/openmrs/public/joda-time/joda-time/2.10.14/joda-time-2.10.14.jar
Downloaded from openmrs-repo: https://openmrs.jfrog.io/openmrs/public/org/openmrs/web/openmrs-web/2.4.0/openmrs-web-2.4.0.jar (158 kB at 250 kB/s)
Downloading from openmrs-repo: https://openmrs.jfrog.io/openmrs/public/org/openmrs/module/uiframework-api/3.4/uiframework-api-3.4.jar
Downloaded from openmrs-repo: https://openmrs.jfrog.io/openmrs/public/org/openmrs/module/uiframework-api/3.4/uiframework-api-3.4.jar (201 kB at 224 kB/s)
Downloading from openmrs-repo: https://openmrs.jfrog.io/openmrs/public/com/github/jknack/handlebars/1.3.1/handlebars-1.3.1.jar
Downloaded from openmrs-repo: https://openmrs.jfrog.io/openmrs/public/joda-time/joda-time/2.10.14/joda-time-2.10.14.jar (644 kB at 573 kB/s)
Downloading from openmrs-repo: https://openmrs.jfrog.io/openmrs/public/org/antlr/antlr4-runtime/4.2.2/antlr4-runtime-4.2.2.jar
Downloaded from openmrs-repo: https://openmrs.jfrog.io/openmrs/public/org/openmrs/api/openmrs-api/2.4.0/openmrs-api-2.4.0.jar (2.8 MB at 2.4 MB/s)
Downloading from openmrs-repo: https://openmrs.jfrog.io/openmrs/public/org/antlr/antlr4-annotations/4.2.2/antlr4-annotations-4.2.2.jar
Downloaded from openmrs-repo: https://openmrs.jfrog.io/openmrs/public/org/openmrs/module/stockmanagement-api/1.4.0/stockmanagement-api-1.4.0.jar (546 kB at 451 kB/s)
Downloading from openmrs-repo: https://openmrs.jfrog.io/openmrs/public/org/mozilla/rhino/1.7R4/rhino-1.7R4.jar
Downloaded from openmrs-repo: https://openmrs.jfrog.io/openmrs/public/org/openmrs/api/openmrs-api/2.4.0/openmrs-api-2.4.0-tests.jar (2.5 MB at 2.0 MB/s)
Downloading from openmrs-repo: https://openmrs.jfrog.io/openmrs/public/org/openmrs/module/idgen-api/4.7.0/idgen-api-4.7.0.jar
Downloaded from openmrs-repo: https://openmrs.jfrog.io/openmrs/public/org/antlr/antlr4-annotations/4.2.2/antlr4-annotations-4.2.2.jar (10 kB at 7.4 kB/s)
Downloading from openmrs-repo: https://openmrs.jfrog.io/openmrs/public/org/apache/httpcomponents/httpclient/4.5.10/httpclient-4.5.10.jar
Downloaded from openmrs-repo: https://openmrs.jfrog.io/openmrs/public/org/antlr/antlr4-runtime/4.2.2/antlr4-runtime-4.2.2.jar (329 kB at 225 kB/s)
Downloading from openmrs-repo: https://openmrs.jfrog.io/openmrs/public/org/apache/httpcomponents/httpcore/4.4.12/httpcore-4.4.12.jar
Downloaded from openmrs-repo: https://openmrs.jfrog.io/openmrs/public/org/openmrs/module/idgen-api/4.7.0/idgen-api-4.7.0.jar (64 kB at 40 kB/s)
Downloading from openmrs-repo: https://openmrs.jfrog.io/openmrs/public/org/reflections/reflections/0.9.8/reflections-0.9.8.jar
Downloaded from openmrs-repo: https://openmrs.jfrog.io/openmrs/public/org/mozilla/rhino/1.7R4/rhino-1.7R4.jar (1.1 MB at 705 kB/s)
Downloading from openmrs-repo: https://openmrs.jfrog.io/openmrs/public/com/google/guava/guava/11.0.2/guava-11.0.2.jar
Downloaded from openmrs-repo: https://openmrs.jfrog.io/openmrs/public/org/apache/httpcomponents/httpclient/4.5.10/httpclient-4.5.10.jar (775 kB at 447 kB/s)
Downloading from openmrs-repo: https://openmrs.jfrog.io/openmrs/public/com/itextpdf/kernel/8.0.2/kernel-8.0.2.jar
Downloaded from openmrs-repo: https://openmrs.jfrog.io/openmrs/public/com/github/jknack/handlebars/1.3.1/handlebars-1.3.1.jar (290 kB at 166 kB/s)
Downloading from openmrs-repo: https://openmrs.jfrog.io/openmrs/public/com/itextpdf/bouncy-castle-connector/8.0.2/bouncy-castle-connector-8.0.2.jar
Downloaded from openmrs-repo: https://openmrs.jfrog.io/openmrs/public/org/apache/httpcomponents/httpcore/4.4.12/httpcore-4.4.12.jar (328 kB at 182 kB/s)
Downloading from openmrs-repo: https://openmrs.jfrog.io/openmrs/public/com/itextpdf/io/8.0.2/io-8.0.2.jar
Downloaded from openmrs-repo: https://openmrs.jfrog.io/openmrs/public/org/reflections/reflections/0.9.8/reflections-0.9.8.jar (103 kB at 55 kB/s)
Downloading from openmrs-repo: https://openmrs.jfrog.io/openmrs/public/com/itextpdf/commons/8.0.2/commons-8.0.2.jar
Downloaded from openmrs-repo: https://openmrs.jfrog.io/openmrs/public/com/itextpdf/bouncy-castle-connector/8.0.2/bouncy-castle-connector-8.0.2.jar (11 kB at 5.7 kB/s)
Downloading from openmrs-repo: https://openmrs.jfrog.io/openmrs/public/com/itextpdf/layout/8.0.2/layout-8.0.2.jar
Downloaded from openmrs-repo: https://openmrs.jfrog.io/openmrs/public/com/google/guava/guava/11.0.2/guava-11.0.2.jar (1.6 MB at 817 kB/s)
Downloading from openmrs-repo: https://openmrs.jfrog.io/openmrs/public/com/itextpdf/barcodes/8.0.2/barcodes-8.0.2.jar
Downloaded from openmrs-repo: https://openmrs.jfrog.io/openmrs/public/com/itextpdf/io/8.0.2/io-8.0.2.jar (813 kB at 376 kB/s)
Downloading from openmrs-repo: https://openmrs.jfrog.io/openmrs/public/com/itextpdf/font-asian/8.0.2/font-asian-8.0.2.jar
Downloaded from openmrs-repo: https://openmrs.jfrog.io/openmrs/public/com/itextpdf/commons/8.0.2/commons-8.0.2.jar (175 kB at 79 kB/s)
Downloaded from openmrs-repo: https://openmrs.jfrog.io/openmrs/public/com/itextpdf/kernel/8.0.2/kernel-8.0.2.jar (1.3 MB at 573 kB/s)
Downloaded from openmrs-repo: https://openmrs.jfrog.io/openmrs/public/com/itextpdf/layout/8.0.2/layout-8.0.2.jar (581 kB at 254 kB/s)
Downloaded from openmrs-repo: https://openmrs.jfrog.io/openmrs/public/com/itextpdf/barcodes/8.0.2/barcodes-8.0.2.jar (151 kB at 64 kB/s)
Downloaded from openmrs-repo: https://openmrs.jfrog.io/openmrs/public/com/itextpdf/font-asian/8.0.2/font-asian-8.0.2.jar (2.8 MB at 1.1 MB/s)
[INFO] 
[INFO] --- maven-clean-plugin:2.5:clean (default-clean) @ billing-api ---
[INFO] 
[INFO] --- jacoco-maven-plugin:0.8.11:prepare-agent (default) @ billing-api ---
[INFO] argLine set to -javaagent:/home/ubuntu/.m2/repository/org/jacoco/org.jacoco.agent/0.8.11/org.jacoco.agent-0.8.11-runtime.jar=destfile=/home/ubuntu/code/openmrs-module-billing/api/target/jacoco.exec
[INFO] 
[INFO] --- formatter-maven-plugin:2.16.0:format (default) @ billing-api ---
[INFO] Using 'UTF-8' encoding to format source files.
[INFO] Number of files to be formatted: 171
[INFO] Successfully formatted:          171 file(s)
[INFO] Fail to format:                  0 file(s)
[INFO] Skipped:                         0 file(s)
[INFO] Read only skipped:               0 file(s)
[INFO] Approximate time taken:          1s
[INFO] 
[INFO] --- maven-resources-plugin:2.6:resources (default-resources) @ billing-api ---
[INFO] Using 'UTF-8' encoding to copy filtered resources.
[INFO] Copying 9 resources
[INFO] 
[INFO] --- maven-compiler-plugin:3.1:compile (default-compile) @ billing-api ---
[INFO] Changes detected - recompiling the module!
[INFO] Compiling 150 source files to /home/ubuntu/code/openmrs-module-billing/api/target/classes
[WARNING] /home/ubuntu/code/openmrs-module-billing/api/src/main/java/org/openmrs/module/billing/api/base/entity/db/hibernate/BaseHibernateRepository.java: Some input files use or override a deprecated API.
[WARNING] /home/ubuntu/code/openmrs-module-billing/api/src/main/java/org/openmrs/module/billing/api/base/entity/db/hibernate/BaseHibernateRepository.java: Recompile with -Xlint:deprecation for details.
[WARNING] /home/ubuntu/code/openmrs-module-billing/api/src/main/java/org/openmrs/module/billing/api/impl/ItemPriceServiceImpl.java: Some input files use unchecked or unsafe operations.
[WARNING] /home/ubuntu/code/openmrs-module-billing/api/src/main/java/org/openmrs/module/billing/api/impl/ItemPriceServiceImpl.java: Recompile with -Xlint:unchecked for details.
[INFO] 
[INFO] --- maven-resources-plugin:2.6:testResources (default-testResources) @ billing-api ---
[INFO] Using 'UTF-8' encoding to copy filtered resources.
[INFO] Copying 12 resources
[INFO] 
[INFO] --- maven-compiler-plugin:3.1:testCompile (default-testCompile) @ billing-api ---
[INFO] Changes detected - recompiling the module!
[INFO] Compiling 20 source files to /home/ubuntu/code/openmrs-module-billing/api/target/test-classes
[WARNING] /home/ubuntu/code/openmrs-module-billing/api/src/test/java/org/openmrs/module/billing/base/BaseModuleContextTest.java: Some input files use or override a deprecated API.
[WARNING] /home/ubuntu/code/openmrs-module-billing/api/src/test/java/org/openmrs/module/billing/base/BaseModuleContextTest.java: Recompile with -Xlint:deprecation for details.
[WARNING] /home/ubuntu/code/openmrs-module-billing/api/src/test/java/org/openmrs/module/billing/base/entity/IObjectDataServiceTest.java: /home/ubuntu/code/openmrs-module-billing/api/src/test/java/org/openmrs/module/billing/base/entity/IObjectDataServiceTest.java uses unchecked or unsafe operations.
[WARNING] /home/ubuntu/code/openmrs-module-billing/api/src/test/java/org/openmrs/module/billing/base/entity/IObjectDataServiceTest.java: Recompile with -Xlint:unchecked for details.
[INFO] 
[INFO] --- maven-surefire-plugin:3.0.0-M8:test (default-test) @ billing-api ---
[INFO] Using auto detected provider org.apache.maven.surefire.junitplatform.JUnitPlatformProvider
[INFO] 
[INFO] -------------------------------------------------------
[INFO]  T E S T S
[INFO] -------------------------------------------------------
[INFO] Running org.openmrs.module.billing.base.LazyRoleTest
WARNING: An illegal reflective access operation has occurred
WARNING: Illegal reflective access by org.codehaus.groovy.reflection.CachedClass (file:/home/ubuntu/.m2/repository/org/codehaus/groovy/groovy-all/2.4.20/groovy-all-2.4.20.jar) to method java.lang.Object.finalize()
WARNING: Please consider reporting this to the maintainers of org.codehaus.groovy.reflection.CachedClass
WARNING: Use --illegal-access=warn to enable warnings of further illegal reflective access operations
WARNING: All illegal access operations will be denied in a future release
[INFO] Tests run: 1, Failures: 0, Errors: 0, Skipped: 0, Time elapsed: 10.959 s - in org.openmrs.module.billing.base.LazyRoleTest
[INFO] Running org.openmrs.module.billing.ITimesheetServiceTest
[INFO] Tests run: 44, Failures: 0, Errors: 0, Skipped: 0, Time elapsed: 5.666 s - in org.openmrs.module.billing.ITimesheetServiceTest
[INFO] Running org.openmrs.module.billing.IPaymentModeServiceTest
[INFO] Tests run: 43, Failures: 0, Errors: 0, Skipped: 0, Time elapsed: 1.084 s - in org.openmrs.module.billing.IPaymentModeServiceTest
[INFO] Running org.openmrs.module.billing.ISequentialReceiptNumberGeneratorServiceTest
[INFO] Tests run: 38, Failures: 0, Errors: 0, Skipped: 0, Time elapsed: 0.844 s - in org.openmrs.module.billing.ISequentialReceiptNumberGeneratorServiceTest
[INFO] Running org.openmrs.module.billing.ICashierOptionsServiceTest
[INFO] Tests run: 2, Failures: 0, Errors: 0, Skipped: 0, Time elapsed: 0.041 s - in org.openmrs.module.billing.ICashierOptionsServiceTest
[INFO] Running org.openmrs.module.billing.ICashPointServiceTest
[INFO] Tests run: 55, Failures: 0, Errors: 0, Skipped: 0, Time elapsed: 5.388 s - in org.openmrs.module.billing.ICashPointServiceTest
[INFO] Running org.openmrs.module.billing.SequentialReceiptNumberGeneratorTest
[ERROR] Tests run: 6, Failures: 0, Errors: 6, Skipped: 0, Time elapsed: 1.117 s <<< FAILURE! - in org.openmrs.module.billing.SequentialReceiptNumberGeneratorTest
[ERROR] org.openmrs.module.billing.SequentialReceiptNumberGeneratorTest.generateNumber_shouldCreateANewReceiptNumberByGroupingType  Time elapsed: 1.091 s  <<< ERROR!
java.lang.IllegalAccessError: class javax.xml.parsers.FactoryFinder (in unnamed module @0x6a39b75d) cannot access class jdk.xml.internal.SecuritySupport (in module java.xml) because module java.xml does not export jdk.xml.internal to unnamed module @0x6a39b75d
	at javax.xml.parsers.FactoryFinder.<clinit>(FactoryFinder.java:69)
	at javax.xml.parsers.DocumentBuilderFactory.newInstance(DocumentBuilderFactory.java:140)
	at org.apache.logging.log4j.core.config.xml.XmlConfiguration.newDocumentBuilder(XmlConfiguration.java:183)
	at org.apache.logging.log4j.core.config.xml.XmlConfiguration.<init>(XmlConfiguration.java:89)
	at org.apache.logging.log4j.core.config.xml.XmlConfigurationFactory.getConfiguration(XmlConfigurationFactory.java:46)
	at org.apache.logging.log4j.core.config.ConfigurationFactory$Factory.getConfiguration(ConfigurationFactory.java:551)
	at org.apache.logging.log4j.core.config.ConfigurationFactory$Factory.getConfiguration(ConfigurationFactory.java:475)
	at org.apache.logging.log4j.core.config.ConfigurationFactory.getConfiguration(ConfigurationFactory.java:323)
	at org.apache.logging.log4j.core.LoggerContext.reconfigure(LoggerContext.java:687)
	at org.apache.logging.log4j.core.LoggerContext.reconfigure(LoggerContext.java:708)
	at org.apache.logging.log4j.core.LoggerContext.start(LoggerContext.java:263)
	at org.apache.logging.log4j.core.impl.Log4jContextFactory.getContext(Log4jContextFactory.java:153)
	at org.apache.logging.log4j.core.impl.Log4jContextFactory.getContext(Log4jContextFactory.java:45)
	at org.apache.logging.log4j.LogManager.getContext(LogManager.java:194)
	at org.apache.logging.log4j.spi.AbstractLoggerAdapter.getContext(AbstractLoggerAdapter.java:138)
	at org.apache.logging.slf4j.Log4jLoggerFactory.getContext(Log4jLoggerFactory.java:45)
	at org.apache.logging.log4j.spi.AbstractLoggerAdapter.getLogger(AbstractLoggerAdapter.java:48)
	at org.apache.logging.slf4j.Log4jLoggerFactory.getLogger(Log4jLoggerFactory.java:30)
	at org.slf4j.LoggerFactory.getLogger(LoggerFactory.java:363)
	at org.slf4j.LoggerFactory.getLogger(LoggerFactory.java:388)
	at org.openmrs.api.context.Context.<clinit>(Context.java:135)
	at jdk.internal.reflect.GeneratedSerializationConstructorAccessor6.newInstance(Unknown Source)
	at java.base/java.lang.reflect.Constructor.newInstance(Constructor.java:490)
	at org.objenesis.instantiator.sun.SunReflectionFactoryInstantiator.newInstance(SunReflectionFactoryInstantiator.java:48)
	at org.objenesis.ObjenesisBase.newInstance(ObjenesisBase.java:73)
	at org.mockito.internal.creation.instance.ObjenesisInstantiator.newInstance(ObjenesisInstantiator.java:21)
	at org.mockito.internal.creation.bytebuddy.SubclassByteBuddyMockMaker.createMock(SubclassByteBuddyMockMaker.java:48)
	at org.mockito.internal.creation.bytebuddy.ByteBuddyMockMaker.createMock(ByteBuddyMockMaker.java:29)
	at org.powermock.api.mockito.mockmaker.PowerMockMaker.createMock(PowerMockMaker.java:41)
	at org.mockito.internal.util.MockUtil.createMock(MockUtil.java:52)
	at org.mockito.internal.MockitoCore.mock(MockitoCore.java:61)
	at org.mockito.Mockito.mock(Mockito.java:1949)
	at org.powermock.api.mockito.internal.mockcreation.DefaultMockCreator.createMethodInvocationControl(DefaultMockCreator.java:108)
	at org.powermock.api.mockito.internal.mockcreation.DefaultMockCreator.doCreateMock(DefaultMockCreator.java:61)
	at org.powermock.api.mockito.internal.mockcreation.DefaultMockCreator.createMock(DefaultMockCreator.java:53)
	at org.powermock.api.mockito.internal.mockcreation.DefaultMockCreator.mock(DefaultMockCreator.java:40)
	at org.powermock.api.mockito.PowerMockito.mockStatic(PowerMockito.java:62)
	at org.openmrs.module.billing.SequentialReceiptNumberGeneratorTest.before(SequentialReceiptNumberGeneratorTest.java:53)
	at java.base/jdk.internal.reflect.NativeMethodAccessorImpl.invoke0(Native Method)
	at java.base/jdk.internal.reflect.NativeMethodAccessorImpl.invoke(NativeMethodAccessorImpl.java:62)
	at java.base/jdk.internal.reflect.DelegatingMethodAccessorImpl.invoke(DelegatingMethodAccessorImpl.java:43)
	at java.base/java.lang.reflect.Method.invoke(Method.java:566)
	at org.junit.internal.runners.MethodRoadie.runBefores(MethodRoadie.java:133)
	at org.junit.internal.runners.MethodRoadie.runBeforesThenTestThenAfters(MethodRoadie.java:96)
	at org.powermock.modules.junit4.internal.impl.PowerMockJUnit44RunnerDelegateImpl$PowerMockJUnit44MethodRunner.executeTest(PowerMockJUnit44RunnerDelegateImpl.java:310)
	at org.powermock.modules.junit4.internal.impl.PowerMockJUnit47RunnerDelegateImpl$PowerMockJUnit47MethodRunner.executeTestInSuper(PowerMockJUnit47RunnerDelegateImpl.java:131)
	at org.powermock.modules.junit4.internal.impl.PowerMockJUnit47RunnerDelegateImpl$PowerMockJUnit47MethodRunner.access$100(PowerMockJUnit47RunnerDelegateImpl.java:59)
	at org.powermock.modules.junit4.internal.impl.PowerMockJUnit47RunnerDelegateImpl$PowerMockJUnit47MethodRunner$TestExecutorStatement.evaluate(PowerMockJUnit47RunnerDelegateImpl.java:147)
	at org.powermock.modules.junit4.internal.impl.PowerMockJUnit47RunnerDelegateImpl$PowerMockJUnit47MethodRunner.evaluateStatement(PowerMockJUnit47RunnerDelegateImpl.java:107)
	at org.powermock.modules.junit4.internal.impl.PowerMockJUnit47RunnerDelegateImpl$PowerMockJUnit47MethodRunner.executeTest(PowerMockJUnit47RunnerDelegateImpl.java:82)
	at org.powermock.modules.junit4.internal.impl.PowerMockJUnit44RunnerDelegateImpl$PowerMockJUnit44MethodRunner.runBeforesThenTestThenAfters(PowerMockJUnit44RunnerDelegateImpl.java:298)
	at org.junit.internal.runners.MethodRoadie.runTest(MethodRoadie.java:87)
	at org.junit.internal.runners.MethodRoadie.run(MethodRoadie.java:50)
	at org.powermock.modules.junit4.internal.impl.PowerMockJUnit44RunnerDelegateImpl.invokeTestMethod(PowerMockJUnit44RunnerDelegateImpl.java:218)
	at org.powermock.modules.junit4.internal.impl.PowerMockJUnit44RunnerDelegateImpl.runMethods(PowerMockJUnit44RunnerDelegateImpl.java:160)
	at org.powermock.modules.junit4.internal.impl.PowerMockJUnit44RunnerDelegateImpl$1.run(PowerMockJUnit44RunnerDelegateImpl.java:134)
	at org.junit.internal.runners.ClassRoadie.runUnprotected(ClassRoadie.java:34)
	at org.junit.internal.runners.ClassRoadie.runProtected(ClassRoadie.java:44)
	at org.powermock.modules.junit4.internal.impl.PowerMockJUnit44RunnerDelegateImpl.run(PowerMockJUnit44RunnerDelegateImpl.java:136)
	at org.powermock.modules.junit4.common.internal.impl.JUnit4TestSuiteChunkerImpl.run(JUnit4TestSuiteChunkerImpl.java:117)
	at org.powermock.modules.junit4.common.internal.impl.AbstractCommonPowerMockRunner.run(AbstractCommonPowerMockRunner.java:57)
	at org.powermock.modules.junit4.PowerMockRunner.run(PowerMockRunner.java:59)
	at org.junit.runner.JUnitCore.run(JUnitCore.java:137)
	at org.junit.runner.JUnitCore.run(JUnitCore.java:115)
	at org.junit.vintage.engine.execution.RunnerExecutor.execute(RunnerExecutor.java:43)
	at java.base/java.util.stream.ForEachOps$ForEachOp$OfRef.accept(ForEachOps.java:183)
	at java.base/java.util.stream.ReferencePipeline$3$1.accept(ReferencePipeline.java:195)
	at java.base/java.util.Iterator.forEachRemaining(Iterator.java:133)
	at java.base/java.util.Spliterators$IteratorSpliterator.forEachRemaining(Spliterators.java:1801)
	at java.base/java.util.stream.AbstractPipeline.copyInto(AbstractPipeline.java:484)
	at java.base/java.util.stream.AbstractPipeline.wrapAndCopyInto(AbstractPipeline.java:474)
	at java.base/java.util.stream.ForEachOps$ForEachOp.evaluateSequential(ForEachOps.java:150)
	at java.base/java.util.stream.ForEachOps$ForEachOp$OfRef.evaluateSequential(ForEachOps.java:173)
	at java.base/java.util.stream.AbstractPipeline.evaluate(AbstractPipeline.java:234)
	at java.base/java.util.stream.ReferencePipeline.forEach(ReferencePipeline.java:497)
	at org.junit.vintage.engine.VintageTestEngine.executeAllChildren(VintageTestEngine.java:82)
	at org.junit.vintage.engine.VintageTestEngine.execute(VintageTestEngine.java:73)
	at org.junit.platform.launcher.core.EngineExecutionOrchestrator.execute(EngineExecutionOrchestrator.java:108)
	at org.junit.platform.launcher.core.EngineExecutionOrchestrator.execute(EngineExecutionOrchestrator.java:88)
	at org.junit.platform.launcher.core.EngineExecutionOrchestrator.lambda$execute$0(EngineExecutionOrchestrator.java:54)
	at org.junit.platform.launcher.core.EngineExecutionOrchestrator.withInterceptedStreams(EngineExecutionOrchestrator.java:67)
	at org.junit.platform.launcher.core.EngineExecutionOrchestrator.execute(EngineExecutionOrchestrator.java:52)
	at org.junit.platform.launcher.core.DefaultLauncher.execute(DefaultLauncher.java:96)
	at org.junit.platform.launcher.core.DefaultLauncher.execute(DefaultLauncher.java:75)
	at org.apache.maven.surefire.junitplatform.LazyLauncher.execute(LazyLauncher.java:55)
	at org.apache.maven.surefire.junitplatform.JUnitPlatformProvider.execute(JUnitPlatformProvider.java:223)
	at org.apache.maven.surefire.junitplatform.JUnitPlatformProvider.invokeAllTests(JUnitPlatformProvider.java:175)
	at org.apache.maven.surefire.junitplatform.JUnitPlatformProvider.invoke(JUnitPlatformProvider.java:139)
	at org.apache.maven.surefire.booter.ForkedBooter.runSuitesInProcess(ForkedBooter.java:456)
	at org.apache.maven.surefire.booter.ForkedBooter.execute(ForkedBooter.java:169)
	at org.apache.maven.surefire.booter.ForkedBooter.run(ForkedBooter.java:595)
	at org.apache.maven.surefire.booter.ForkedBooter.main(ForkedBooter.java:581)

[ERROR] org.openmrs.module.billing.SequentialReceiptNumberGeneratorTest.generateNumber_shouldCreateANewReceiptNumberBySequenceType  Time elapsed: 0.001 s  <<< ERROR!
java.lang.NoClassDefFoundError: Could not initialize class org.openmrs.api.context.Context$MockitoMock$95241486
	at jdk.internal.reflect.GeneratedSerializationConstructorAccessor6.newInstance(Unknown Source)
	at java.base/java.lang.reflect.Constructor.newInstance(Constructor.java:490)
	at org.objenesis.instantiator.sun.SunReflectionFactoryInstantiator.newInstance(SunReflectionFactoryInstantiator.java:48)
	at org.objenesis.ObjenesisBase.newInstance(ObjenesisBase.java:73)
	at org.mockito.internal.creation.instance.ObjenesisInstantiator.newInstance(ObjenesisInstantiator.java:21)
	at org.mockito.internal.creation.bytebuddy.SubclassByteBuddyMockMaker.createMock(SubclassByteBuddyMockMaker.java:48)
	at org.mockito.internal.creation.bytebuddy.ByteBuddyMockMaker.createMock(ByteBuddyMockMaker.java:29)
	at org.powermock.api.mockito.mockmaker.PowerMockMaker.createMock(PowerMockMaker.java:41)
	at org.mockito.internal.util.MockUtil.createMock(MockUtil.java:52)
	at org.mockito.internal.MockitoCore.mock(MockitoCore.java:61)
	at org.mockito.Mockito.mock(Mockito.java:1949)
	at org.powermock.api.mockito.internal.mockcreation.DefaultMockCreator.createMethodInvocationControl(DefaultMockCreator.java:108)
	at org.powermock.api.mockito.internal.mockcreation.DefaultMockCreator.doCreateMock(DefaultMockCreator.java:61)
	at org.powermock.api.mockito.internal.mockcreation.DefaultMockCreator.createMock(DefaultMockCreator.java:53)
	at org.powermock.api.mockito.internal.mockcreation.DefaultMockCreator.mock(DefaultMockCreator.java:40)
	at org.powermock.api.mockito.PowerMockito.mockStatic(PowerMockito.java:62)
	at org.openmrs.module.billing.SequentialReceiptNumberGeneratorTest.before(SequentialReceiptNumberGeneratorTest.java:53)
	at java.base/jdk.internal.reflect.NativeMethodAccessorImpl.invoke0(Native Method)
	at java.base/jdk.internal.reflect.NativeMethodAccessorImpl.invoke(NativeMethodAccessorImpl.java:62)
	at java.base/jdk.internal.reflect.DelegatingMethodAccessorImpl.invoke(DelegatingMethodAccessorImpl.java:43)
	at java.base/java.lang.reflect.Method.invoke(Method.java:566)
	at org.junit.internal.runners.MethodRoadie.runBefores(MethodRoadie.java:133)
	at org.junit.internal.runners.MethodRoadie.runBeforesThenTestThenAfters(MethodRoadie.java:96)
	at org.powermock.modules.junit4.internal.impl.PowerMockJUnit44RunnerDelegateImpl$PowerMockJUnit44MethodRunner.executeTest(PowerMockJUnit44RunnerDelegateImpl.java:310)
	at org.powermock.modules.junit4.internal.impl.PowerMockJUnit47RunnerDelegateImpl$PowerMockJUnit47MethodRunner.executeTestInSuper(PowerMockJUnit47RunnerDelegateImpl.java:131)
	at org.powermock.modules.junit4.internal.impl.PowerMockJUnit47RunnerDelegateImpl$PowerMockJUnit47MethodRunner.access$100(PowerMockJUnit47RunnerDelegateImpl.java:59)
	at org.powermock.modules.junit4.internal.impl.PowerMockJUnit47RunnerDelegateImpl$PowerMockJUnit47MethodRunner$TestExecutorStatement.evaluate(PowerMockJUnit47RunnerDelegateImpl.java:147)
	at org.powermock.modules.junit4.internal.impl.PowerMockJUnit47RunnerDelegateImpl$PowerMockJUnit47MethodRunner.evaluateStatement(PowerMockJUnit47RunnerDelegateImpl.java:107)
	at org.powermock.modules.junit4.internal.impl.PowerMockJUnit47RunnerDelegateImpl$PowerMockJUnit47MethodRunner.executeTest(PowerMockJUnit47RunnerDelegateImpl.java:82)
	at org.powermock.modules.junit4.internal.impl.PowerMockJUnit44RunnerDelegateImpl$PowerMockJUnit44MethodRunner.runBeforesThenTestThenAfters(PowerMockJUnit44RunnerDelegateImpl.java:298)
	at org.junit.internal.runners.MethodRoadie.runTest(MethodRoadie.java:87)
	at org.junit.internal.runners.MethodRoadie.run(MethodRoadie.java:50)
	at org.powermock.modules.junit4.internal.impl.PowerMockJUnit44RunnerDelegateImpl.invokeTestMethod(PowerMockJUnit44RunnerDelegateImpl.java:218)
	at org.powermock.modules.junit4.internal.impl.PowerMockJUnit44RunnerDelegateImpl.runMethods(PowerMockJUnit44RunnerDelegateImpl.java:160)
	at org.powermock.modules.junit4.internal.impl.PowerMockJUnit44RunnerDelegateImpl$1.run(PowerMockJUnit44RunnerDelegateImpl.java:134)
	at org.junit.internal.runners.ClassRoadie.runUnprotected(ClassRoadie.java:34)
	at org.junit.internal.runners.ClassRoadie.runProtected(ClassRoadie.java:44)
	at org.powermock.modules.junit4.internal.impl.PowerMockJUnit44RunnerDelegateImpl.run(PowerMockJUnit44RunnerDelegateImpl.java:136)
	at org.powermock.modules.junit4.common.internal.impl.JUnit4TestSuiteChunkerImpl.run(JUnit4TestSuiteChunkerImpl.java:117)
	at org.powermock.modules.junit4.common.internal.impl.AbstractCommonPowerMockRunner.run(AbstractCommonPowerMockRunner.java:57)
	at org.powermock.modules.junit4.PowerMockRunner.run(PowerMockRunner.java:59)
	at org.junit.runner.JUnitCore.run(JUnitCore.java:137)
	at org.junit.runner.JUnitCore.run(JUnitCore.java:115)
	at org.junit.vintage.engine.execution.RunnerExecutor.execute(RunnerExecutor.java:43)
	at java.base/java.util.stream.ForEachOps$ForEachOp$OfRef.accept(ForEachOps.java:183)
	at java.base/java.util.stream.ReferencePipeline$3$1.accept(ReferencePipeline.java:195)
	at java.base/java.util.Iterator.forEachRemaining(Iterator.java:133)
	at java.base/java.util.Spliterators$IteratorSpliterator.forEachRemaining(Spliterators.java:1801)
	at java.base/java.util.stream.AbstractPipeline.copyInto(AbstractPipeline.java:484)
	at java.base/java.util.stream.AbstractPipeline.wrapAndCopyInto(AbstractPipeline.java:474)
	at java.base/java.util.stream.ForEachOps$ForEachOp.evaluateSequential(ForEachOps.java:150)
	at java.base/java.util.stream.ForEachOps$ForEachOp$OfRef.evaluateSequential(ForEachOps.java:173)
	at java.base/java.util.stream.AbstractPipeline.evaluate(AbstractPipeline.java:234)
	at java.base/java.util.stream.ReferencePipeline.forEach(ReferencePipeline.java:497)
	at org.junit.vintage.engine.VintageTestEngine.executeAllChildren(VintageTestEngine.java:82)
	at org.junit.vintage.engine.VintageTestEngine.execute(VintageTestEngine.java:73)
	at org.junit.platform.launcher.core.EngineExecutionOrchestrator.execute(EngineExecutionOrchestrator.java:108)
	at org.junit.platform.launcher.core.EngineExecutionOrchestrator.execute(EngineExecutionOrchestrator.java:88)
	at org.junit.platform.launcher.core.EngineExecutionOrchestrator.lambda$execute$0(EngineExecutionOrchestrator.java:54)
	at org.junit.platform.launcher.core.EngineExecutionOrchestrator.withInterceptedStreams(EngineExecutionOrchestrator.java:67)
	at org.junit.platform.launcher.core.EngineExecutionOrchestrator.execute(EngineExecutionOrchestrator.java:52)
	at org.junit.platform.launcher.core.DefaultLauncher.execute(DefaultLauncher.java:96)
	at org.junit.platform.launcher.core.DefaultLauncher.execute(DefaultLauncher.java:75)
	at org.apache.maven.surefire.junitplatform.LazyLauncher.execute(LazyLauncher.java:55)
	at org.apache.maven.surefire.junitplatform.JUnitPlatformProvider.execute(JUnitPlatformProvider.java:223)
	at org.apache.maven.surefire.junitplatform.JUnitPlatformProvider.invokeAllTests(JUnitPlatformProvider.java:175)
	at org.apache.maven.surefire.junitplatform.JUnitPlatformProvider.invoke(JUnitPlatformProvider.java:139)
	at org.apache.maven.surefire.booter.ForkedBooter.runSuitesInProcess(ForkedBooter.java:456)
	at org.apache.maven.surefire.booter.ForkedBooter.execute(ForkedBooter.java:169)
	at org.apache.maven.surefire.booter.ForkedBooter.run(ForkedBooter.java:595)
	at org.apache.maven.surefire.booter.ForkedBooter.main(ForkedBooter.java:581)

[ERROR] org.openmrs.module.billing.SequentialReceiptNumberGeneratorTest.generateNumber_shouldCreateANewReceiptNumberUsingTheSpecifiedSeparator  Time elapsed: 0.001 s  <<< ERROR!
java.lang.NoClassDefFoundError: Could not initialize class org.openmrs.api.context.Context$MockitoMock$95241486
	at jdk.internal.reflect.GeneratedSerializationConstructorAccessor6.newInstance(Unknown Source)
	at java.base/java.lang.reflect.Constructor.newInstance(Constructor.java:490)
	at org.objenesis.instantiator.sun.SunReflectionFactoryInstantiator.newInstance(SunReflectionFactoryInstantiator.java:48)
	at org.objenesis.ObjenesisBase.newInstance(ObjenesisBase.java:73)
	at org.mockito.internal.creation.instance.ObjenesisInstantiator.newInstance(ObjenesisInstantiator.java:21)
	at org.mockito.internal.creation.bytebuddy.SubclassByteBuddyMockMaker.createMock(SubclassByteBuddyMockMaker.java:48)
	at org.mockito.internal.creation.bytebuddy.ByteBuddyMockMaker.createMock(ByteBuddyMockMaker.java:29)
	at org.powermock.api.mockito.mockmaker.PowerMockMaker.createMock(PowerMockMaker.java:41)
	at org.mockito.internal.util.MockUtil.createMock(MockUtil.java:52)
	at org.mockito.internal.MockitoCore.mock(MockitoCore.java:61)
	at org.mockito.Mockito.mock(Mockito.java:1949)
	at org.powermock.api.mockito.internal.mockcreation.DefaultMockCreator.createMethodInvocationControl(DefaultMockCreator.java:108)
	at org.powermock.api.mockito.internal.mockcreation.DefaultMockCreator.doCreateMock(DefaultMockCreator.java:61)
	at org.powermock.api.mockito.internal.mockcreation.DefaultMockCreator.createMock(DefaultMockCreator.java:53)
	at org.powermock.api.mockito.internal.mockcreation.DefaultMockCreator.mock(DefaultMockCreator.java:40)
	at org.powermock.api.mockito.PowerMockito.mockStatic(PowerMockito.java:62)
	at org.openmrs.module.billing.SequentialReceiptNumberGeneratorTest.before(SequentialReceiptNumberGeneratorTest.java:53)
	at java.base/jdk.internal.reflect.NativeMethodAccessorImpl.invoke0(Native Method)
	at java.base/jdk.internal.reflect.NativeMethodAccessorImpl.invoke(NativeMethodAccessorImpl.java:62)
	at java.base/jdk.internal.reflect.DelegatingMethodAccessorImpl.invoke(DelegatingMethodAccessorImpl.java:43)
	at java.base/java.lang.reflect.Method.invoke(Method.java:566)
	at org.junit.internal.runners.MethodRoadie.runBefores(MethodRoadie.java:133)
	at org.junit.internal.runners.MethodRoadie.runBeforesThenTestThenAfters(MethodRoadie.java:96)
	at org.powermock.modules.junit4.internal.impl.PowerMockJUnit44RunnerDelegateImpl$PowerMockJUnit44MethodRunner.executeTest(PowerMockJUnit44RunnerDelegateImpl.java:310)
	at org.powermock.modules.junit4.internal.impl.PowerMockJUnit47RunnerDelegateImpl$PowerMockJUnit47MethodRunner.executeTestInSuper(PowerMockJUnit47RunnerDelegateImpl.java:131)
	at org.powermock.modules.junit4.internal.impl.PowerMockJUnit47RunnerDelegateImpl$PowerMockJUnit47MethodRunner.access$100(PowerMockJUnit47RunnerDelegateImpl.java:59)
	at org.powermock.modules.junit4.internal.impl.PowerMockJUnit47RunnerDelegateImpl$PowerMockJUnit47MethodRunner$TestExecutorStatement.evaluate(PowerMockJUnit47RunnerDelegateImpl.java:147)
	at org.powermock.modules.junit4.internal.impl.PowerMockJUnit47RunnerDelegateImpl$PowerMockJUnit47MethodRunner.evaluateStatement(PowerMockJUnit47RunnerDelegateImpl.java:107)
	at org.powermock.modules.junit4.internal.impl.PowerMockJUnit47RunnerDelegateImpl$PowerMockJUnit47MethodRunner.executeTest(PowerMockJUnit47RunnerDelegateImpl.java:82)
	at org.powermock.modules.junit4.internal.impl.PowerMockJUnit44RunnerDelegateImpl$PowerMockJUnit44MethodRunner.runBeforesThenTestThenAfters(PowerMockJUnit44RunnerDelegateImpl.java:298)
	at org.junit.internal.runners.MethodRoadie.runTest(MethodRoadie.java:87)
	at org.junit.internal.runners.MethodRoadie.run(MethodRoadie.java:50)
	at org.powermock.modules.junit4.internal.impl.PowerMockJUnit44RunnerDelegateImpl.invokeTestMethod(PowerMockJUnit44RunnerDelegateImpl.java:218)
	at org.powermock.modules.junit4.internal.impl.PowerMockJUnit44RunnerDelegateImpl.runMethods(PowerMockJUnit44RunnerDelegateImpl.java:160)
	at org.powermock.modules.junit4.internal.impl.PowerMockJUnit44RunnerDelegateImpl$1.run(PowerMockJUnit44RunnerDelegateImpl.java:134)
	at org.junit.internal.runners.ClassRoadie.runUnprotected(ClassRoadie.java:34)
	at org.junit.internal.runners.ClassRoadie.runProtected(ClassRoadie.java:44)
	at org.powermock.modules.junit4.internal.impl.PowerMockJUnit44RunnerDelegateImpl.run(PowerMockJUnit44RunnerDelegateImpl.java:136)
	at org.powermock.modules.junit4.common.internal.impl.JUnit4TestSuiteChunkerImpl.run(JUnit4TestSuiteChunkerImpl.java:117)
	at org.powermock.modules.junit4.common.internal.impl.AbstractCommonPowerMockRunner.run(AbstractCommonPowerMockRunner.java:57)
	at org.powermock.modules.junit4.PowerMockRunner.run(PowerMockRunner.java:59)
	at org.junit.runner.JUnitCore.run(JUnitCore.java:137)
	at org.junit.runner.JUnitCore.run(JUnitCore.java:115)
	at org.junit.vintage.engine.execution.RunnerExecutor.execute(RunnerExecutor.java:43)
	at java.base/java.util.stream.ForEachOps$ForEachOp$OfRef.accept(ForEachOps.java:183)
	at java.base/java.util.stream.ReferencePipeline$3$1.accept(ReferencePipeline.java:195)
	at java.base/java.util.Iterator.forEachRemaining(Iterator.java:133)
	at java.base/java.util.Spliterators$IteratorSpliterator.forEachRemaining(Spliterators.java:1801)
	at java.base/java.util.stream.AbstractPipeline.copyInto(AbstractPipeline.java:484)
	at java.base/java.util.stream.AbstractPipeline.wrapAndCopyInto(AbstractPipeline.java:474)
	at java.base/java.util.stream.ForEachOps$ForEachOp.evaluateSequential(ForEachOps.java:150)
	at java.base/java.util.stream.ForEachOps$ForEachOp$OfRef.evaluateSequential(ForEachOps.java:173)
	at java.base/java.util.stream.AbstractPipeline.evaluate(AbstractPipeline.java:234)
	at java.base/java.util.stream.ReferencePipeline.forEach(ReferencePipeline.java:497)
	at org.junit.vintage.engine.VintageTestEngine.executeAllChildren(VintageTestEngine.java:82)
	at org.junit.vintage.engine.VintageTestEngine.execute(VintageTestEngine.java:73)
	at org.junit.platform.launcher.core.EngineExecutionOrchestrator.execute(EngineExecutionOrchestrator.java:108)
	at org.junit.platform.launcher.core.EngineExecutionOrchestrator.execute(EngineExecutionOrchestrator.java:88)
	at org.junit.platform.launcher.core.EngineExecutionOrchestrator.lambda$execute$0(EngineExecutionOrchestrator.java:54)
	at org.junit.platform.launcher.core.EngineExecutionOrchestrator.withInterceptedStreams(EngineExecutionOrchestrator.java:67)
	at org.junit.platform.launcher.core.EngineExecutionOrchestrator.execute(EngineExecutionOrchestrator.java:52)
	at org.junit.platform.launcher.core.DefaultLauncher.execute(DefaultLauncher.java:96)
	at org.junit.platform.launcher.core.DefaultLauncher.execute(DefaultLauncher.java:75)
	at org.apache.maven.surefire.junitplatform.LazyLauncher.execute(LazyLauncher.java:55)
	at org.apache.maven.surefire.junitplatform.JUnitPlatformProvider.execute(JUnitPlatformProvider.java:223)
	at org.apache.maven.surefire.junitplatform.JUnitPlatformProvider.invokeAllTests(JUnitPlatformProvider.java:175)
	at org.apache.maven.surefire.junitplatform.JUnitPlatformProvider.invoke(JUnitPlatformProvider.java:139)
	at org.apache.maven.surefire.booter.ForkedBooter.runSuitesInProcess(ForkedBooter.java:456)
	at org.apache.maven.surefire.booter.ForkedBooter.execute(ForkedBooter.java:169)
	at org.apache.maven.surefire.booter.ForkedBooter.run(ForkedBooter.java:595)
	at org.apache.maven.surefire.booter.ForkedBooter.main(ForkedBooter.java:581)

[ERROR] org.openmrs.module.billing.SequentialReceiptNumberGeneratorTest.generateNumber_shouldGenerateAndSetTheCorrectCheckDigit  Time elapsed: 0 s  <<< ERROR!
java.lang.NoClassDefFoundError: Could not initialize class org.openmrs.api.context.Context$MockitoMock$95241486
	at jdk.internal.reflect.GeneratedSerializationConstructorAccessor6.newInstance(Unknown Source)
	at java.base/java.lang.reflect.Constructor.newInstance(Constructor.java:490)
	at org.objenesis.instantiator.sun.SunReflectionFactoryInstantiator.newInstance(SunReflectionFactoryInstantiator.java:48)
	at org.objenesis.ObjenesisBase.newInstance(ObjenesisBase.java:73)
	at org.mockito.internal.creation.instance.ObjenesisInstantiator.newInstance(ObjenesisInstantiator.java:21)
	at org.mockito.internal.creation.bytebuddy.SubclassByteBuddyMockMaker.createMock(SubclassByteBuddyMockMaker.java:48)
	at org.mockito.internal.creation.bytebuddy.ByteBuddyMockMaker.createMock(ByteBuddyMockMaker.java:29)
	at org.powermock.api.mockito.mockmaker.PowerMockMaker.createMock(PowerMockMaker.java:41)
	at org.mockito.internal.util.MockUtil.createMock(MockUtil.java:52)
	at org.mockito.internal.MockitoCore.mock(MockitoCore.java:61)
	at org.mockito.Mockito.mock(Mockito.java:1949)
	at org.powermock.api.mockito.internal.mockcreation.DefaultMockCreator.createMethodInvocationControl(DefaultMockCreator.java:108)
	at org.powermock.api.mockito.internal.mockcreation.DefaultMockCreator.doCreateMock(DefaultMockCreator.java:61)
	at org.powermock.api.mockito.internal.mockcreation.DefaultMockCreator.createMock(DefaultMockCreator.java:53)
	at org.powermock.api.mockito.internal.mockcreation.DefaultMockCreator.mock(DefaultMockCreator.java:40)
	at org.powermock.api.mockito.PowerMockito.mockStatic(PowerMockito.java:62)
	at org.openmrs.module.billing.SequentialReceiptNumberGeneratorTest.before(SequentialReceiptNumberGeneratorTest.java:53)
	at java.base/jdk.internal.reflect.NativeMethodAccessorImpl.invoke0(Native Method)
	at java.base/jdk.internal.reflect.NativeMethodAccessorImpl.invoke(NativeMethodAccessorImpl.java:62)
	at java.base/jdk.internal.reflect.DelegatingMethodAccessorImpl.invoke(DelegatingMethodAccessorImpl.java:43)
	at java.base/java.lang.reflect.Method.invoke(Method.java:566)
	at org.junit.internal.runners.MethodRoadie.runBefores(MethodRoadie.java:133)
	at org.junit.internal.runners.MethodRoadie.runBeforesThenTestThenAfters(MethodRoadie.java:96)
	at org.powermock.modules.junit4.internal.impl.PowerMockJUnit44RunnerDelegateImpl$PowerMockJUnit44MethodRunner.executeTest(PowerMockJUnit44RunnerDelegateImpl.java:310)
	at org.powermock.modules.junit4.internal.impl.PowerMockJUnit47RunnerDelegateImpl$PowerMockJUnit47MethodRunner.executeTestInSuper(PowerMockJUnit47RunnerDelegateImpl.java:131)
	at org.powermock.modules.junit4.internal.impl.PowerMockJUnit47RunnerDelegateImpl$PowerMockJUnit47MethodRunner.access$100(PowerMockJUnit47RunnerDelegateImpl.java:59)
	at org.powermock.modules.junit4.internal.impl.PowerMockJUnit47RunnerDelegateImpl$PowerMockJUnit47MethodRunner$TestExecutorStatement.evaluate(PowerMockJUnit47RunnerDelegateImpl.java:147)
	at org.powermock.modules.junit4.internal.impl.PowerMockJUnit47RunnerDelegateImpl$PowerMockJUnit47MethodRunner.evaluateStatement(PowerMockJUnit47RunnerDelegateImpl.java:107)
	at org.powermock.modules.junit4.internal.impl.PowerMockJUnit47RunnerDelegateImpl$PowerMockJUnit47MethodRunner.executeTest(PowerMockJUnit47RunnerDelegateImpl.java:82)
	at org.powermock.modules.junit4.internal.impl.PowerMockJUnit44RunnerDelegateImpl$PowerMockJUnit44MethodRunner.runBeforesThenTestThenAfters(PowerMockJUnit44RunnerDelegateImpl.java:298)
	at org.junit.internal.runners.MethodRoadie.runTest(MethodRoadie.java:87)
	at org.junit.internal.runners.MethodRoadie.run(MethodRoadie.java:50)
	at org.powermock.modules.junit4.internal.impl.PowerMockJUnit44RunnerDelegateImpl.invokeTestMethod(PowerMockJUnit44RunnerDelegateImpl.java:218)
	at org.powermock.modules.junit4.internal.impl.PowerMockJUnit44RunnerDelegateImpl.runMethods(PowerMockJUnit44RunnerDelegateImpl.java:160)
	at org.powermock.modules.junit4.internal.impl.PowerMockJUnit44RunnerDelegateImpl$1.run(PowerMockJUnit44RunnerDelegateImpl.java:134)
	at org.junit.internal.runners.ClassRoadie.runUnprotected(ClassRoadie.java:34)
	at org.junit.internal.runners.ClassRoadie.runProtected(ClassRoadie.java:44)
	at org.powermock.modules.junit4.internal.impl.PowerMockJUnit44RunnerDelegateImpl.run(PowerMockJUnit44RunnerDelegateImpl.java:136)
	at org.powermock.modules.junit4.common.internal.impl.JUnit4TestSuiteChunkerImpl.run(JUnit4TestSuiteChunkerImpl.java:117)
	at org.powermock.modules.junit4.common.internal.impl.AbstractCommonPowerMockRunner.run(AbstractCommonPowerMockRunner.java:57)
	at org.powermock.modules.junit4.PowerMockRunner.run(PowerMockRunner.java:59)
	at org.junit.runner.JUnitCore.run(JUnitCore.java:137)
	at org.junit.runner.JUnitCore.run(JUnitCore.java:115)
	at org.junit.vintage.engine.execution.RunnerExecutor.execute(RunnerExecutor.java:43)
	at java.base/java.util.stream.ForEachOps$ForEachOp$OfRef.accept(ForEachOps.java:183)
	at java.base/java.util.stream.ReferencePipeline$3$1.accept(ReferencePipeline.java:195)
	at java.base/java.util.Iterator.forEachRemaining(Iterator.java:133)
	at java.base/java.util.Spliterators$IteratorSpliterator.forEachRemaining(Spliterators.java:1801)
	at java.base/java.util.stream.AbstractPipeline.copyInto(AbstractPipeline.java:484)
	at java.base/java.util.stream.AbstractPipeline.wrapAndCopyInto(AbstractPipeline.java:474)
	at java.base/java.util.stream.ForEachOps$ForEachOp.evaluateSequential(ForEachOps.java:150)
	at java.base/java.util.stream.ForEachOps$ForEachOp$OfRef.evaluateSequential(ForEachOps.java:173)
	at java.base/java.util.stream.AbstractPipeline.evaluate(AbstractPipeline.java:234)
	at java.base/java.util.stream.ReferencePipeline.forEach(ReferencePipeline.java:497)
	at org.junit.vintage.engine.VintageTestEngine.executeAllChildren(VintageTestEngine.java:82)
	at org.junit.vintage.engine.VintageTestEngine.execute(VintageTestEngine.java:73)
	at org.junit.platform.launcher.core.EngineExecutionOrchestrator.execute(EngineExecutionOrchestrator.java:108)
	at org.junit.platform.launcher.core.EngineExecutionOrchestrator.execute(EngineExecutionOrchestrator.java:88)
	at org.junit.platform.launcher.core.EngineExecutionOrchestrator.lambda$execute$0(EngineExecutionOrchestrator.java:54)
	at org.junit.platform.launcher.core.EngineExecutionOrchestrator.withInterceptedStreams(EngineExecutionOrchestrator.java:67)
	at org.junit.platform.launcher.core.EngineExecutionOrchestrator.execute(EngineExecutionOrchestrator.java:52)
	at org.junit.platform.launcher.core.DefaultLauncher.execute(DefaultLauncher.java:96)
	at org.junit.platform.launcher.core.DefaultLauncher.execute(DefaultLauncher.java:75)
	at org.apache.maven.surefire.junitplatform.LazyLauncher.execute(LazyLauncher.java:55)
	at org.apache.maven.surefire.junitplatform.JUnitPlatformProvider.execute(JUnitPlatformProvider.java:223)
	at org.apache.maven.surefire.junitplatform.JUnitPlatformProvider.invokeAllTests(JUnitPlatformProvider.java:175)
	at org.apache.maven.surefire.junitplatform.JUnitPlatformProvider.invoke(JUnitPlatformProvider.java:139)
	at org.apache.maven.surefire.booter.ForkedBooter.runSuitesInProcess(ForkedBooter.java:456)
	at org.apache.maven.surefire.booter.ForkedBooter.execute(ForkedBooter.java:169)
	at org.apache.maven.surefire.booter.ForkedBooter.run(ForkedBooter.java:595)
	at org.apache.maven.surefire.booter.ForkedBooter.main(ForkedBooter.java:581)

[ERROR] org.openmrs.module.billing.SequentialReceiptNumberGeneratorTest.generateNumber_shouldUpdateSequenceTableWithTheNewSequenceByGroup  Time elapsed: 0 s  <<< ERROR!
java.lang.NoClassDefFoundError: Could not initialize class org.openmrs.api.context.Context$MockitoMock$95241486
	at jdk.internal.reflect.GeneratedSerializationConstructorAccessor6.newInstance(Unknown Source)
	at java.base/java.lang.reflect.Constructor.newInstance(Constructor.java:490)
	at org.objenesis.instantiator.sun.SunReflectionFactoryInstantiator.newInstance(SunReflectionFactoryInstantiator.java:48)
	at org.objenesis.ObjenesisBase.newInstance(ObjenesisBase.java:73)
	at org.mockito.internal.creation.instance.ObjenesisInstantiator.newInstance(ObjenesisInstantiator.java:21)
	at org.mockito.internal.creation.bytebuddy.SubclassByteBuddyMockMaker.createMock(SubclassByteBuddyMockMaker.java:48)
	at org.mockito.internal.creation.bytebuddy.ByteBuddyMockMaker.createMock(ByteBuddyMockMaker.java:29)
	at org.powermock.api.mockito.mockmaker.PowerMockMaker.createMock(PowerMockMaker.java:41)
	at org.mockito.internal.util.MockUtil.createMock(MockUtil.java:52)
	at org.mockito.internal.MockitoCore.mock(MockitoCore.java:61)
	at org.mockito.Mockito.mock(Mockito.java:1949)
	at org.powermock.api.mockito.internal.mockcreation.DefaultMockCreator.createMethodInvocationControl(DefaultMockCreator.java:108)
	at org.powermock.api.mockito.internal.mockcreation.DefaultMockCreator.doCreateMock(DefaultMockCreator.java:61)
	at org.powermock.api.mockito.internal.mockcreation.DefaultMockCreator.createMock(DefaultMockCreator.java:53)
	at org.powermock.api.mockito.internal.mockcreation.DefaultMockCreator.mock(DefaultMockCreator.java:40)
	at org.powermock.api.mockito.PowerMockito.mockStatic(PowerMockito.java:62)
	at org.openmrs.module.billing.SequentialReceiptNumberGeneratorTest.before(SequentialReceiptNumberGeneratorTest.java:53)
	at java.base/jdk.internal.reflect.NativeMethodAccessorImpl.invoke0(Native Method)
	at java.base/jdk.internal.reflect.NativeMethodAccessorImpl.invoke(NativeMethodAccessorImpl.java:62)
	at java.base/jdk.internal.reflect.DelegatingMethodAccessorImpl.invoke(DelegatingMethodAccessorImpl.java:43)
	at java.base/java.lang.reflect.Method.invoke(Method.java:566)
	at org.junit.internal.runners.MethodRoadie.runBefores(MethodRoadie.java:133)
	at org.junit.internal.runners.MethodRoadie.runBeforesThenTestThenAfters(MethodRoadie.java:96)
	at org.powermock.modules.junit4.internal.impl.PowerMockJUnit44RunnerDelegateImpl$PowerMockJUnit44MethodRunner.executeTest(PowerMockJUnit44RunnerDelegateImpl.java:310)
	at org.powermock.modules.junit4.internal.impl.PowerMockJUnit47RunnerDelegateImpl$PowerMockJUnit47MethodRunner.executeTestInSuper(PowerMockJUnit47RunnerDelegateImpl.java:131)
	at org.powermock.modules.junit4.internal.impl.PowerMockJUnit47RunnerDelegateImpl$PowerMockJUnit47MethodRunner.access$100(PowerMockJUnit47RunnerDelegateImpl.java:59)
	at org.powermock.modules.junit4.internal.impl.PowerMockJUnit47RunnerDelegateImpl$PowerMockJUnit47MethodRunner$TestExecutorStatement.evaluate(PowerMockJUnit47RunnerDelegateImpl.java:147)
	at org.powermock.modules.junit4.internal.impl.PowerMockJUnit47RunnerDelegateImpl$PowerMockJUnit47MethodRunner.evaluateStatement(PowerMockJUnit47RunnerDelegateImpl.java:107)
	at org.powermock.modules.junit4.internal.impl.PowerMockJUnit47RunnerDelegateImpl$PowerMockJUnit47MethodRunner.executeTest(PowerMockJUnit47RunnerDelegateImpl.java:82)
	at org.powermock.modules.junit4.internal.impl.PowerMockJUnit44RunnerDelegateImpl$PowerMockJUnit44MethodRunner.runBeforesThenTestThenAfters(PowerMockJUnit44RunnerDelegateImpl.java:298)
	at org.junit.internal.runners.MethodRoadie.runTest(MethodRoadie.java:87)
	at org.junit.internal.runners.MethodRoadie.run(MethodRoadie.java:50)
	at org.powermock.modules.junit4.internal.impl.PowerMockJUnit44RunnerDelegateImpl.invokeTestMethod(PowerMockJUnit44RunnerDelegateImpl.java:218)
	at org.powermock.modules.junit4.internal.impl.PowerMockJUnit44RunnerDelegateImpl.runMethods(PowerMockJUnit44RunnerDelegateImpl.java:160)
	at org.powermock.modules.junit4.internal.impl.PowerMockJUnit44RunnerDelegateImpl$1.run(PowerMockJUnit44RunnerDelegateImpl.java:134)
	at org.junit.internal.runners.ClassRoadie.runUnprotected(ClassRoadie.java:34)
	at org.junit.internal.runners.ClassRoadie.runProtected(ClassRoadie.java:44)
	at org.powermock.modules.junit4.internal.impl.PowerMockJUnit44RunnerDelegateImpl.run(PowerMockJUnit44RunnerDelegateImpl.java:136)
	at org.powermock.modules.junit4.common.internal.impl.JUnit4TestSuiteChunkerImpl.run(JUnit4TestSuiteChunkerImpl.java:117)
	at org.powermock.modules.junit4.common.internal.impl.AbstractCommonPowerMockRunner.run(AbstractCommonPowerMockRunner.java:57)
	at org.powermock.modules.junit4.PowerMockRunner.run(PowerMockRunner.java:59)
	at org.junit.runner.JUnitCore.run(JUnitCore.java:137)
	at org.junit.runner.JUnitCore.run(JUnitCore.java:115)
	at org.junit.vintage.engine.execution.RunnerExecutor.execute(RunnerExecutor.java:43)
	at java.base/java.util.stream.ForEachOps$ForEachOp$OfRef.accept(ForEachOps.java:183)
	at java.base/java.util.stream.ReferencePipeline$3$1.accept(ReferencePipeline.java:195)
	at java.base/java.util.Iterator.forEachRemaining(Iterator.java:133)
	at java.base/java.util.Spliterators$IteratorSpliterator.forEachRemaining(Spliterators.java:1801)
	at java.base/java.util.stream.AbstractPipeline.copyInto(AbstractPipeline.java:484)
	at java.base/java.util.stream.AbstractPipeline.wrapAndCopyInto(AbstractPipeline.java:474)
	at java.base/java.util.stream.ForEachOps$ForEachOp.evaluateSequential(ForEachOps.java:150)
	at java.base/java.util.stream.ForEachOps$ForEachOp$OfRef.evaluateSequential(ForEachOps.java:173)
	at java.base/java.util.stream.AbstractPipeline.evaluate(AbstractPipeline.java:234)
	at java.base/java.util.stream.ReferencePipeline.forEach(ReferencePipeline.java:497)
	at org.junit.vintage.engine.VintageTestEngine.executeAllChildren(VintageTestEngine.java:82)
	at org.junit.vintage.engine.VintageTestEngine.execute(VintageTestEngine.java:73)
	at org.junit.platform.launcher.core.EngineExecutionOrchestrator.execute(EngineExecutionOrchestrator.java:108)
	at org.junit.platform.launcher.core.EngineExecutionOrchestrator.execute(EngineExecutionOrchestrator.java:88)
	at org.junit.platform.launcher.core.EngineExecutionOrchestrator.lambda$execute$0(EngineExecutionOrchestrator.java:54)
	at org.junit.platform.launcher.core.EngineExecutionOrchestrator.withInterceptedStreams(EngineExecutionOrchestrator.java:67)
	at org.junit.platform.launcher.core.EngineExecutionOrchestrator.execute(EngineExecutionOrchestrator.java:52)
	at org.junit.platform.launcher.core.DefaultLauncher.execute(DefaultLauncher.java:96)
	at org.junit.platform.launcher.core.DefaultLauncher.execute(DefaultLauncher.java:75)
	at org.apache.maven.surefire.junitplatform.LazyLauncher.execute(LazyLauncher.java:55)
	at org.apache.maven.surefire.junitplatform.JUnitPlatformProvider.execute(JUnitPlatformProvider.java:223)
	at org.apache.maven.surefire.junitplatform.JUnitPlatformProvider.invokeAllTests(JUnitPlatformProvider.java:175)
	at org.apache.maven.surefire.junitplatform.JUnitPlatformProvider.invoke(JUnitPlatformProvider.java:139)
	at org.apache.maven.surefire.booter.ForkedBooter.runSuitesInProcess(ForkedBooter.java:456)
	at org.apache.maven.surefire.booter.ForkedBooter.execute(ForkedBooter.java:169)
	at org.apache.maven.surefire.booter.ForkedBooter.run(ForkedBooter.java:595)
	at org.apache.maven.surefire.booter.ForkedBooter.main(ForkedBooter.java:581)

[ERROR] org.openmrs.module.billing.SequentialReceiptNumberGeneratorTest.generateNumber_shouldThrowNullPointerExceptionIfBillIsNull  Time elapsed: 0 s  <<< ERROR!
java.lang.NoClassDefFoundError: Could not initialize class org.openmrs.api.context.Context$MockitoMock$95241486
	at jdk.internal.reflect.GeneratedSerializationConstructorAccessor6.newInstance(Unknown Source)
	at java.base/java.lang.reflect.Constructor.newInstance(Constructor.java:490)
	at org.objenesis.instantiator.sun.SunReflectionFactoryInstantiator.newInstance(SunReflectionFactoryInstantiator.java:48)
	at org.objenesis.ObjenesisBase.newInstance(ObjenesisBase.java:73)
	at org.mockito.internal.creation.instance.ObjenesisInstantiator.newInstance(ObjenesisInstantiator.java:21)
	at org.mockito.internal.creation.bytebuddy.SubclassByteBuddyMockMaker.createMock(SubclassByteBuddyMockMaker.java:48)
	at org.mockito.internal.creation.bytebuddy.ByteBuddyMockMaker.createMock(ByteBuddyMockMaker.java:29)
	at org.powermock.api.mockito.mockmaker.PowerMockMaker.createMock(PowerMockMaker.java:41)
	at org.mockito.internal.util.MockUtil.createMock(MockUtil.java:52)
	at org.mockito.internal.MockitoCore.mock(MockitoCore.java:61)
	at org.mockito.Mockito.mock(Mockito.java:1949)
	at org.powermock.api.mockito.internal.mockcreation.DefaultMockCreator.createMethodInvocationControl(DefaultMockCreator.java:108)
	at org.powermock.api.mockito.internal.mockcreation.DefaultMockCreator.doCreateMock(DefaultMockCreator.java:61)
	at org.powermock.api.mockito.internal.mockcreation.DefaultMockCreator.createMock(DefaultMockCreator.java:53)
	at org.powermock.api.mockito.internal.mockcreation.DefaultMockCreator.mock(DefaultMockCreator.java:40)
	at org.powermock.api.mockito.PowerMockito.mockStatic(PowerMockito.java:62)
	at org.openmrs.module.billing.SequentialReceiptNumberGeneratorTest.before(SequentialReceiptNumberGeneratorTest.java:53)
	at java.base/jdk.internal.reflect.NativeMethodAccessorImpl.invoke0(Native Method)
	at java.base/jdk.internal.reflect.NativeMethodAccessorImpl.invoke(NativeMethodAccessorImpl.java:62)
	at java.base/jdk.internal.reflect.DelegatingMethodAccessorImpl.invoke(DelegatingMethodAccessorImpl.java:43)
	at java.base/java.lang.reflect.Method.invoke(Method.java:566)
	at org.junit.internal.runners.MethodRoadie.runBefores(MethodRoadie.java:133)
	at org.junit.internal.runners.MethodRoadie.runBeforesThenTestThenAfters(MethodRoadie.java:96)
	at org.powermock.modules.junit4.internal.impl.PowerMockJUnit44RunnerDelegateImpl$PowerMockJUnit44MethodRunner.executeTest(PowerMockJUnit44RunnerDelegateImpl.java:310)
	at org.powermock.modules.junit4.internal.impl.PowerMockJUnit47RunnerDelegateImpl$PowerMockJUnit47MethodRunner.executeTestInSuper(PowerMockJUnit47RunnerDelegateImpl.java:131)
	at org.powermock.modules.junit4.internal.impl.PowerMockJUnit47RunnerDelegateImpl$PowerMockJUnit47MethodRunner.access$100(PowerMockJUnit47RunnerDelegateImpl.java:59)
	at org.powermock.modules.junit4.internal.impl.PowerMockJUnit47RunnerDelegateImpl$PowerMockJUnit47MethodRunner$TestExecutorStatement.evaluate(PowerMockJUnit47RunnerDelegateImpl.java:147)
	at org.powermock.modules.junit4.internal.impl.PowerMockJUnit47RunnerDelegateImpl$PowerMockJUnit47MethodRunner.evaluateStatement(PowerMockJUnit47RunnerDelegateImpl.java:107)
	at org.powermock.modules.junit4.internal.impl.PowerMockJUnit47RunnerDelegateImpl$PowerMockJUnit47MethodRunner.executeTest(PowerMockJUnit47RunnerDelegateImpl.java:82)
	at org.powermock.modules.junit4.internal.impl.PowerMockJUnit44RunnerDelegateImpl$PowerMockJUnit44MethodRunner.runBeforesThenTestThenAfters(PowerMockJUnit44RunnerDelegateImpl.java:298)
	at org.junit.internal.runners.MethodRoadie.runTest(MethodRoadie.java:87)
	at org.junit.internal.runners.MethodRoadie.run(MethodRoadie.java:50)
	at org.powermock.modules.junit4.internal.impl.PowerMockJUnit44RunnerDelegateImpl.invokeTestMethod(PowerMockJUnit44RunnerDelegateImpl.java:218)
	at org.powermock.modules.junit4.internal.impl.PowerMockJUnit44RunnerDelegateImpl.runMethods(PowerMockJUnit44RunnerDelegateImpl.java:160)
	at org.powermock.modules.junit4.internal.impl.PowerMockJUnit44RunnerDelegateImpl$1.run(PowerMockJUnit44RunnerDelegateImpl.java:134)
	at org.junit.internal.runners.ClassRoadie.runUnprotected(ClassRoadie.java:34)
	at org.junit.internal.runners.ClassRoadie.runProtected(ClassRoadie.java:44)
	at org.powermock.modules.junit4.internal.impl.PowerMockJUnit44RunnerDelegateImpl.run(PowerMockJUnit44RunnerDelegateImpl.java:136)
	at org.powermock.modules.junit4.common.internal.impl.JUnit4TestSuiteChunkerImpl.run(JUnit4TestSuiteChunkerImpl.java:117)
	at org.powermock.modules.junit4.common.internal.impl.AbstractCommonPowerMockRunner.run(AbstractCommonPowerMockRunner.java:57)
	at org.powermock.modules.junit4.PowerMockRunner.run(PowerMockRunner.java:59)
	at org.junit.runner.JUnitCore.run(JUnitCore.java:137)
	at org.junit.runner.JUnitCore.run(JUnitCore.java:115)
	at org.junit.vintage.engine.execution.RunnerExecutor.execute(RunnerExecutor.java:43)
	at java.base/java.util.stream.ForEachOps$ForEachOp$OfRef.accept(ForEachOps.java:183)
	at java.base/java.util.stream.ReferencePipeline$3$1.accept(ReferencePipeline.java:195)
	at java.base/java.util.Iterator.forEachRemaining(Iterator.java:133)
	at java.base/java.util.Spliterators$IteratorSpliterator.forEachRemaining(Spliterators.java:1801)
	at java.base/java.util.stream.AbstractPipeline.copyInto(AbstractPipeline.java:484)
	at java.base/java.util.stream.AbstractPipeline.wrapAndCopyInto(AbstractPipeline.java:474)
	at java.base/java.util.stream.ForEachOps$ForEachOp.evaluateSequential(ForEachOps.java:150)
	at java.base/java.util.stream.ForEachOps$ForEachOp$OfRef.evaluateSequential(ForEachOps.java:173)
	at java.base/java.util.stream.AbstractPipeline.evaluate(AbstractPipeline.java:234)
	at java.base/java.util.stream.ReferencePipeline.forEach(ReferencePipeline.java:497)
	at org.junit.vintage.engine.VintageTestEngine.executeAllChildren(VintageTestEngine.java:82)
	at org.junit.vintage.engine.VintageTestEngine.execute(VintageTestEngine.java:73)
	at org.junit.platform.launcher.core.EngineExecutionOrchestrator.execute(EngineExecutionOrchestrator.java:108)
	at org.junit.platform.launcher.core.EngineExecutionOrchestrator.execute(EngineExecutionOrchestrator.java:88)
	at org.junit.platform.launcher.core.EngineExecutionOrchestrator.lambda$execute$0(EngineExecutionOrchestrator.java:54)
	at org.junit.platform.launcher.core.EngineExecutionOrchestrator.withInterceptedStreams(EngineExecutionOrchestrator.java:67)
	at org.junit.platform.launcher.core.EngineExecutionOrchestrator.execute(EngineExecutionOrchestrator.java:52)
	at org.junit.platform.launcher.core.DefaultLauncher.execute(DefaultLauncher.java:96)
	at org.junit.platform.launcher.core.DefaultLauncher.execute(DefaultLauncher.java:75)
	at org.apache.maven.surefire.junitplatform.LazyLauncher.execute(LazyLauncher.java:55)
	at org.apache.maven.surefire.junitplatform.JUnitPlatformProvider.execute(JUnitPlatformProvider.java:223)
	at org.apache.maven.surefire.junitplatform.JUnitPlatformProvider.invokeAllTests(JUnitPlatformProvider.java:175)
	at org.apache.maven.surefire.junitplatform.JUnitPlatformProvider.invoke(JUnitPlatformProvider.java:139)
	at org.apache.maven.surefire.booter.ForkedBooter.runSuitesInProcess(ForkedBooter.java:456)
	at org.apache.maven.surefire.booter.ForkedBooter.execute(ForkedBooter.java:169)
	at org.apache.maven.surefire.booter.ForkedBooter.run(ForkedBooter.java:595)
	at org.apache.maven.surefire.booter.ForkedBooter.main(ForkedBooter.java:581)

[INFO] 
[INFO] Results:
[INFO] 
[ERROR] Errors: 
[ERROR]   SequentialReceiptNumberGeneratorTest.before:53  IllegalAccess class javax.xml.parsers.FactoryFinder (in unnamed module @0x6a39b75d) cannot access class jdk.xml.internal.SecuritySupport (in module java.xml) because module java.xml does not export jdk.xml.internal to unnamed module @0x6a39b75d
[ERROR]   SequentialReceiptNumberGeneratorTest.before:53  NoClassDefFound Could not initialize class org.openmrs.api.context.Context$MockitoMock$95241486
[ERROR]   SequentialReceiptNumberGeneratorTest.before:53  NoClassDefFound Could not initialize class org.openmrs.api.context.Context$MockitoMock$95241486
[ERROR]   SequentialReceiptNumberGeneratorTest.before:53  NoClassDefFound Could not initialize class org.openmrs.api.context.Context$MockitoMock$95241486
[ERROR]   SequentialReceiptNumberGeneratorTest.before:53  NoClassDefFound Could not initialize class org.openmrs.api.context.Context$MockitoMock$95241486
[ERROR]   SequentialReceiptNumberGeneratorTest.before:53  NoClassDefFound Could not initialize class org.openmrs.api.context.Context$MockitoMock$95241486
[INFO] 
[ERROR] Tests run: 189, Failures: 0, Errors: 6, Skipped: 0
[INFO] 
[INFO] ------------------------------------------------------------------------
[INFO] Reactor Summary for OpenHMIS Billing Module 1.3.3-SNAPSHOT:
[INFO] 
[INFO] OpenHMIS Billing Module ............................ SUCCESS [  0.204 s]
[INFO] OpenMrs Billing Module API ......................... FAILURE [ 42.260 s]
[INFO] OpenHMIS Billing Module OMOD ....................... SKIPPED
[INFO] ------------------------------------------------------------------------
[INFO] BUILD FAILURE
[INFO] ------------------------------------------------------------------------
[INFO] Total time:  42.541 s
[INFO] Finished at: 2025-08-02T12:44:33Z
[INFO] ------------------------------------------------------------------------
[ERROR] Failed to execute goal org.apache.maven.plugins:maven-surefire-plugin:3.0.0-M8:test (default-test) on project billing-api: 
[ERROR] 
[ERROR] Please refer to /home/ubuntu/code/openmrs-module-billing/api/target/surefire-reports for the individual test results.
[ERROR] Please refer to dump files (if any exist) [date].dump, [date]-jvmRun[N].dump and [date].dumpstream.
[ERROR] -> [Help 1]
[ERROR] 
[ERROR] To see the full stack trace of the errors, re-run Maven with the -e switch.
[ERROR] Re-run Maven using the -X switch to enable full debug logging.
[ERROR] 
[ERROR] For more information about the errors and possible solutions, please read the following articles:
[ERROR] [Help 1] http://cwiki.apache.org/confluence/display/MAVEN/MojoFailureException
[ERROR] 
[ERROR] After correcting the problems, you can resume the build with the command
[ERROR]   mvn <args> -rf :billing-api
ubuntu@ip-10-0-22-13:~/code/openmrs-module-billing$ 

